<PubSub publisherId="42" xmlns:xsi="http://www.w3.org/2001/XMLSchema-instance" xsi:noNamespaceSchemaLocation="s2opc_pubsub_config.xsd">
    <connection address="opc.udp://232.1.2.101:4840" mode="publisher">
        <message id="21" version="1" publishingInterval="1000" securityMode="none">
            <variable nodeId="ns=1;s=PubVarResult" dataType="Byte" displayName="ignored"/>
            <variable nodeId="ns=1;s=PubVarInfo" dataType="String" displayName="ignored"/>
            <variable nodeId="ns=1;s=PubVarLoops" dataType="UInt32" displayName="ignored"/>
            <variable nodeId="ns=1;s=PubVarUpTime" dataType="UInt32" displayName="ignored"/>
        </message>
    </connection>
    <!-- The emitter subscribes to the variable that has been looped-back,
         but stores it in another cell of the cache -->
    <connection address="opc.udp://232.1.2.100:4840" mode="subscriber">
        <message id="20" version="1" publishingInterval="1" securityMode="none" publisherId="42">
            <variable nodeId="ns=1;s=SubVarLoops" dataType="UInt32" displayName="ignored"/>
            <variable nodeId="ns=1;s=SubPeriodMs" dataType="UInt32" displayName="ignored"/>
            <variable nodeId="ns=1;s=Spare64" dataType="UInt64" displayName="ignored"/>
        </message>
    </connection>
</PubSub>
