<PubSub xmlns:xsi="http://www.w3.org/2001/XMLSchema-instance" xsi:noNamespaceSchemaLocation="s2opc_pubsub_config.xsd">
    <connection address="mqtts://192.168.1.64:1883" publisherId="42" mode="publisher" mqttUsername="user1" mqttPassword="password" >
        <message groupId="14" groupVersion="1" publishingInterval="1000." mqttTopic="S2OPC" >
          <dataset>
            <variable nodeId="ns=1;s=PubUInt" displayName="varUInt" dataType="Unt32"/>
            <variable nodeId="ns=2;i=6" displayName="PubFloat" dataType="Float"/>
          </dataset>
        </message>
        <message groupId="15" groupVersion="1" publishingInterval="2000." >
          <dataset>
            <variable nodeId="ns=1;s=PubInt" displayName="varInt" dataType="Int32"/>
            <variable nodeId="ns=1;s=PubUInt" displayName="varUInt" dataType="UInt32"/>
          </dataset>
        </message>
    </connection>
</PubSub>
