<PubSub publisherId="42" xmlns:xsi="http://www.w3.org/2001/XMLSchema-instance" xsi:noNamespaceSchemaLocation="s2opc_pubsub_config.xsd">
    <connection address="opc.eth://01-00-00-01-04-00" mode="subscriber" interfaceName="test_veth">
        <message id="14" version="1" publishingInterval="100." publisherId="42" securityMode="signAndEncrypt">
            <variable nodeId="ns=1;s=SubBool" displayName="varBool" dataType="Boolean"/>
            <variable nodeId="ns=1;s=SubString" displayName="varString" dataType="String"/>
        </message>
        <message id="15" version="1" publishingInterval="1000." publisherId="42">
            <variable nodeId="ns=1;s=SubInt" displayName="varInt" dataType="Int64"/>
            <variable nodeId="ns=1;s=SubUInt" displayName="varUInt" dataType="UInt64"/>
        </message>
    </connection>
</PubSub>
